{
  "refCatalogueSchema": "https://raw.githubusercontent.com/amrutur/smart_city_schemas/blob/master/catalogue_schema_1.txt",
  "id": "rbc_sl_1",
  "resourceSchemaVersion": "1.0.0",
  "resourceType": "streetlight",
  "tags": [
    "onstreet",
    "Energy",
    "still under development!"
  ],
  "UI": {
    "value": "1234", "description": "Globally Unique ID of the resource",
    "accessModifier": "private"
  },
  "latitude": {
    "value": 13.0143335,
    "ontologyRef": "http://www.w3.org/2003/01/geo/wgs84_pos#"
  },
  "longitude": {
    "value": 77.5678424,
    "ontologyRef": "http://www.w3.org/2003/01/geo/wgs84_pos#"
  },
  "owner": {
    "name": "IISC",
    "website": "http://www.iisc.ac.in"
  },
  "provider": {
    "name": "Robert Bosch Centre for Cyber Physical Systems, IISc",
    "website": "http://rbccps.org"
  },
  "accessMechanism": {
    "requestAccessSite": "http://rbccps.org/requestAccess",
    "accessEndPoint": "https://rbccps.org/api/{id}",
    "subscriptionEndPoint": "mqtt://rbccps.org/subscription/{id}",
    "additionalResourceInfo": "http://rbccps.org/resourceInfo"
  },
  "data_schema": {
    "type": "object",
    "properties": {
        "dataSamplingInstant": {
          "type": "string",
          "description": "Sampling Time in UTC format",
          "units": "seconds",
          "readOnly": "true",
          "accessModifier": "public"
        },
        "caseTemperature": {
          "type": "number",
          "description": "Temperature of the device casing",
          "units": "degreeCelsius",
          "readOnly": "true",
          "accessModifier": "public"
        },
        "powerConsumption": {
          "type": "number",
          "description": "Power consumption of the device",
          "units": "watts",
          "readOnly": "true",
          "accessModifier": "public"
        },
        "luxOutput": {
          "type": "number",
          "description": "lux output of LED measured at LED",
          "units": "lux",
          "readOnly": "true",
          "accessModifier": "public"
        },
        "ambientLux": {
          "type": "number",
          "description": "lux value of ambient",
          "units": "lux",
          "readOnly": "true",
          "accessModifier": "public"
        },
        "targetPowerState": {
          "type": "string",
          "enum": [
            "ON",
            "OFF"
          ],
          "description": "If set to ON, turns ON the device. If OFF turns OFF the device. Writeable parameter. Writeable only allowed for authorized apps",
          "accessModifier": "protected"
        },
        "targetBrightnessLevel": {
          "type": "number",
          "description": "Number between 0 to 100 to indicate the percentage brightness level. Writeable only allowed for authorized apps",
          "units": "percent",
          "accessModifier": "protected"
        },
        "targetControlPolicy": {
          "enum": [
            "AUTO_TIMER",
            "AUTO_LUX",
            "MANUAL"
          ],
          "description": "Indicates which of the behaviours the device should implement. AUTO_TIMER is timer based, AUTO_LUX uses ambient light and MANUAL is controlled by app. Writeable only allowed for authorized apps",
          "accessModifier": "protected"
        },
        "targetAutoTimerParams": {
          "type": "object",
          "properties": {
            "targetOnTime": {
              "type": "number",
              "description": "Indicates time of day in seconds from 12 midnight when device turns ON in AUTO_TIMER. Writeable only allowed for authorized apps",
              "units": "seconds",
              "accessModifier": "protected"
            },
            "targetOffTime": {
              "type": "number",
              "description": "Indicates time of day in seconds from 12 midnight when device turns OFF in AUTO_TIMER. Writeable only allowed for authorized apps",
              "units": "seconds",
              "accessModifier": "protected"
            }
          }
        },
        "targetAutoLuxParams": {
          "type": "object",
          "properties": {
            "targetOnLux": {
              "type": "number",
              "description": "Indicates ambient lux when device turns ON in AUTO_LUX. Writeable only allowed for authorized apps",
              "units": "lux",
              "accessModifier": "protected"
            },
            "targetOffLux": {
              "type": "number",
              "description": "Indicates ambient lux when device turns OFF in AUTO_LUX. Writeable only allowed for authorized apps",
              "units": "lux",
              "accessModifier": "protected"
            }
          }
        }
    },
    "additionalProperties": false
  }
}
